text,category
"GOAL REMINDER: Q1 target is 10K followers. Current: 6K. Keep pushing content daily.",goal
"PLAN CHECK-IN: Content calendar runs Mon-Fri. Are all posts scheduled for this week?",plan
"CAMPAIGN UPDATE: Review analytics from last week's campaign. What worked? What didn't?",campaign
"GOAL REMINDER: Engagement rate target is 5%. Check your metrics today.",goal
"PLAN CHECK-IN: Partnership outreach — did we follow up with all leads this week?",plan
"CAMPAIGN UPDATE: New campaign assets due by Friday. Who's on graphics?",campaign
